{
  "schema_version": 1,
  "library_name": "Aquarium Manager Starter Fish Library",
  "updated": "2026-10-06",
  "species": [
    {
      "id": "cardinal_tetra",
      "common_name": "Cardinal tetra",
      "scientific_name": "Paracheirodon axelrodi",
      "aliases": [
        "cardinal",
        "cardinal tetras"
      ],
      "adult_size_cm": 3.5,
      "temperature": {
        "min": 23.0,
        "max": 29.0
      },
      "ph": {
        "min": 3.5,
        "max": 7.5
      },
      "gh": {
        "min": 1.0,
        "max": 12.0
      },
      "kh": null,
      "minimum_group": 8,
      "minimum_tank": {
        "length_cm": 60,
        "width_cm": 30,
        "height_cm": null
      },
      "social_type": "shoal",
      "temperament": "peaceful",
      "swimming_zone": "middle",
      "cautions": [
        "Best kept in a shoal of at least 8–10."
      ],
      "source": {
        "label": "Seriously Fish",
        "url": "https://www.seriouslyfish.com/species/paracheirodon-axelrodi"
      }
    },
    {
      "id": "buenos_aires_tetra",
      "common_name": "Buenos Aires tetra",
      "scientific_name": "Hyphessobrycon anisitsi",
      "aliases": [
        "buenos aires tetras",
        "buenos aries tetra",
        "buenos aries tetras"
      ],
      "adult_size_cm": 6.0,
      "temperature": {
        "min": 16.0,
        "max": 28.0
      },
      "ph": {
        "min": 5.5,
        "max": 8.5
      },
      "gh": {
        "min": 1.0,
        "max": 20.0
      },
      "kh": null,
      "minimum_group": 8,
      "minimum_tank": {
        "length_cm": 90,
        "width_cm": 30,
        "height_cm": null
      },
      "social_type": "shoal",
      "temperament": "active; can fin-nip",
      "swimming_zone": "middle",
      "cautions": [
        "Keep at least 8–10; undersized groups can increase fin-nipping.",
        "Needs a relatively long tank for active swimming."
      ],
      "source": {
        "label": "Seriously Fish",
        "url": "https://www.seriouslyfish.com/species/hyphessobrycon-anisitsi"
      }
    },
    {
      "id": "angelfish",
      "common_name": "Angelfish",
      "scientific_name": "Pterophyllum scalare",
      "aliases": [
        "angel fish",
        "freshwater angelfish",
        "scalare"
      ],
      "adult_size_cm": 15.0,
      "temperature": {
        "min": 24.0,
        "max": 30.0
      },
      "ph": {
        "min": 6.0,
        "max": 7.4
      },
      "gh": {
        "min": 0.0,
        "max": 15.0
      },
      "kh": null,
      "minimum_group": null,
      "minimum_tank": {
        "length_cm": 100,
        "width_cm": 40,
        "height_cm": 50
      },
      "social_type": "pair or small group",
      "temperament": "generally peaceful cichlid; territorial when breeding",
      "swimming_zone": "middle",
      "cautions": [
        "Adults need a tall aquarium and may eat sufficiently small fish.",
        "Individuals can become territorial, especially when breeding."
      ],
      "source": {
        "label": "Seriously Fish",
        "url": "https://www.seriouslyfish.com/species/pterophyllum-scalare"
      }
    },
    {
      "id": "bristlenose_pleco",
      "common_name": "Bristlenose pleco",
      "scientific_name": "Ancistrus sp. '3'",
      "aliases": [
        "bristlenose",
        "bristlenose catfish",
        "common bristlenose",
        "ancistrus"
      ],
      "adult_size_cm": 12.5,
      "temperature": {
        "min": 21.0,
        "max": 26.0
      },
      "ph": {
        "min": 5.5,
        "max": 7.5
      },
      "gh": {
        "min": 1.0,
        "max": 15.0
      },
      "kh": null,
      "minimum_group": 1,
      "minimum_tank": {
        "length_cm": 60,
        "width_cm": 30,
        "height_cm": null
      },
      "social_type": "single or pair",
      "temperament": "peaceful; territorial with similar catfish",
      "swimming_zone": "bottom",
      "cautions": [
        "Provide cover and be cautious with multiple similar plecos."
      ],
      "source": {
        "label": "Seriously Fish",
        "url": "https://www.seriouslyfish.com/species/ancistrus-cf-cirrhosus"
      }
    },
    {
      "id": "bronze_corydoras",
      "common_name": "Bronze Cory",
      "scientific_name": "Osteogaster aenea",
      "aliases": [],
      "adult_size_cm": 7.5,
      "temperature": {
        "min": 25.0,
        "max": 28.0
      },
      "ph": {
        "min": 6.0,
        "max": 8.0
      },
      "gh": {
        "min": 5.0,
        "max": 19.0
      },
      "kh": null,
      "minimum_group": 4,
      "minimum_tank": {
        "length_cm": 60.0,
        "width_cm": null,
        "height_cm": null
      },
      "social_type": "shoal",
      "temperament": "peaceful",
      "swimming_zone": "bottom",
      "minimum_tank_volume_l": 72.0,
      "difficulty": "easy",
      "environment_type": "freshwater",
      "ecology": "demersal",
      "climate": "subtropical",
      "distribution": "South America: Colombia and Trinidad to La Plata River basin east of the Andes.",
      "field_sources": {
        "adult_size_cm": "seriouslyfish",
        "temperature": "fishbase",
        "ph": "fishbase",
        "gh": "fishbase",
        "minimum_group": "seriouslyfish",
        "minimum_tank": "fishbase",
        "minimum_tank_volume_l": "seriouslyfish",
        "social_type": "seriouslyfish",
        "temperament": "seriouslyfish",
        "difficulty": "seriouslyfish",
        "environment_type": "fishbase",
        "ecology": "fishbase",
        "climate": "fishbase",
        "distribution": "fishbase"
      },
      "sources": {
        "seriouslyfish": {
          "status": "found",
          "url": "https://www.seriouslyfish.com/species/osteogaster-aenea",
          "checked": "2026-10-05"
        },
        "fishbase": {
          "status": "found",
          "url": "https://www.fishbase.se/summary/Osteogaster-aenea.html",
          "checked": "2026-10-05"
        }
      },
      "source_notes": [
        "minimum_group differs between sources; SeriouslyFish value used."
      ],
      "cautions": [
        "Keep at least 4 individuals."
      ]
    },
    {
      "id": "paracheirodon_innesi",
      "common_name": "Neon Tetra",
      "scientific_name": "Paracheirodon innesi",
      "aliases": [],
      "adult_size_cm": 3.0,
      "temperature": {
        "min": 20.0,
        "max": 26.0
      },
      "ph": {
        "min": 5.5,
        "max": 6.5
      },
      "gh": {
        "min": 1.0,
        "max": 5.0
      },
      "kh": null,
      "minimum_group": 8,
      "minimum_tank": {
        "length_cm": 60.0,
        "width_cm": null,
        "height_cm": null
      },
      "social_type": "shoal",
      "temperament": "peaceful",
      "swimming_zone": "",
      "cautions": [
        "Keep at least 8 individuals."
      ],
      "sources": {
        "seriouslyfish": {
          "status": "found",
          "url": "https://www.seriouslyfish.com/species/paracheirodon-innesi",
          "checked": "2026-10-05"
        },
        "fishbase": {
          "status": "found",
          "url": "https://www.fishbase.se/summary/Paracheirodon-innesi.html",
          "checked": "2026-10-05"
        }
      },
      "minimum_tank_volume_l": 54.0,
      "difficulty": "easy",
      "diet_type": "omnivorous",
      "environment_type": "freshwater",
      "ecology": "pelagic",
      "climate": "tropical",
      "distribution": "South America: Blackwater or clearwater stream tributaries of the Solimões River.",
      "field_sources": {
        "adult_size_cm": "seriouslyfish",
        "temperature": "fishbase",
        "ph": "seriouslyfish",
        "gh": "seriouslyfish",
        "minimum_group": "seriouslyfish",
        "minimum_tank": "fishbase",
        "minimum_tank_volume_l": "seriouslyfish",
        "social_type": "seriouslyfish",
        "temperament": "seriouslyfish",
        "difficulty": "seriouslyfish",
        "diet_type": "seriouslyfish",
        "environment_type": "fishbase",
        "ecology": "fishbase",
        "climate": "fishbase",
        "distribution": "fishbase"
      },
      "source_notes": [
        "adult_size_cm differs between sources; SeriouslyFish value used.",
        "ph differs between sources; SeriouslyFish value used.",
        "gh differs between sources; SeriouslyFish value used.",
        "minimum_group differs between sources; SeriouslyFish value used."
      ]
    },
    {
      "id": "paracheirodon_simulans",
      "common_name": "Green Neon Tetra",
      "scientific_name": "Paracheirodon simulans",
      "aliases": [],
      "kh": null,
      "swimming_zone": "",
      "cautions": [],
      "field_sources": {
        "adult_size_cm": "seriouslyfish",
        "temperature": "fishbase",
        "ph": "fishbase",
        "minimum_tank_volume_l": "seriouslyfish",
        "social_type": "seriouslyfish",
        "temperament": "seriouslyfish",
        "difficulty": "seriouslyfish",
        "diet_type": "seriouslyfish",
        "environment_type": "fishbase",
        "ecology": "fishbase",
        "climate": "fishbase",
        "distribution": "fishbase"
      },
      "sources": {
        "seriouslyfish": {
          "status": "found",
          "url": "https://www.seriouslyfish.com/species/paracheirodon-simulans",
          "checked": "2026-10-05"
        },
        "fishbase": {
          "status": "found",
          "url": "https://www.fishbase.se/summary/Paracheirodon-simulans.html",
          "checked": "2026-10-05"
        }
      },
      "source_notes": [
        "adult_size_cm differs between sources; SeriouslyFish value used."
      ],